{
  "id": "SUSPECT_MISSIONARY",
  "name": "Missionary Elara",
  "age": 55,
  "occupation": "Imperial Missionary",
  "description": "A preacher of many years. Recently, her followers have begun acting in questionable ways, claiming the Emperor speaks directly through dreams.",
  "portraitId": "portrait_missionary"
}
