{
  "id": "SUSPECT_TECHPRIEST",
  "name": "Magos Kaelen",
  "age": 341,
  "occupation": "Tech Priest",
  "description": "A high-ranking Tech Priest of the Adeptus Mechanicus. Suspected of harboring ancient Xenos technology. His left manipulator differs significantly from the rest of his augments.",
  "portraitId": "portrait_techpriest"
}
